{
  "schema_version": "1.0",
  "host": "bobs-mbp.local",
  "result": "held",
  "lock_before": "a1b2c3d",
  "lock_after": "a1b2c3d",
  "changed": [],
  "held_for_approval": [
    { "dimension": "cli", "from": "1.2.0", "to": "2.0.0", "reason": "major; ecosystem.yml policy=hold-majors" }
  ],
  "blocked": []
}
