{
  "schema_version": "1.0",
  "host": "bobs-mbp.local",
  "result": "applied",
  "lock_before": "a1b2c3d",
  "lock_after": "e4f5a6b",
  "changed": [
    { "dimension": "cli", "layer": "foundation", "item": "cc-binary", "op": "updated", "from": "1.2.9", "to": "1.3.0", "signed": true, "severity_trailer": null, "shadowed_by": null },
    { "dimension": "knowledge", "layer": "org", "item": "onboarding-guide.md", "op": "added", "from": null, "to": "d4e5f6a", "signed": true, "severity_trailer": null, "shadowed_by": null }
  ],
  "held_for_approval": [],
  "blocked": []
}
